ArtistID,ArtistName,LoginID,Password,TotalSongs,UsersFollowing,ArtistBio,Payment
1,"Alka Yagnik",tvoyrgpiw,kbmiaczcm,1,13,"She is noted in Indian cinema for a career spanning over three decades.",9909105
2,"Arijit Singh",ggzgxnfmm,eovwkrmgn,1,110,"He sings predominantly in Hindi and Bengali but has also performed in various other Indian languages.",5588288
3,"Asha Bhosle",ffjyvifca,tjauszosd,1,129,"She is best known for her playback singing in Hindi cinema, although she has a wider repertoire.",875190
4,"Neha Kakkar",aypbngnez,flepalbdb,2,42,"She competed on season 2 of the television reality show Indian Idol in 2006 ",3191418
5,"Shreya Ghoshal",ralpzjemq,faafkpdkt,3,31,"She has received four National Film Awards, four Kerala State Film Awards, two Tamil Nadu State Film Awards, seven Filmfare Awards ",6793888
6,"Vishal Shekar",tmrazmqic,mykjbwgtz,1,23,"Vishal n Shekhar are an Indian music production, singer & songwriting duo.",613993
7,"Kishore Kumar",hgxeodszf,rbaofptps,1,173,"Abhas Kumar Ganguly (born 4 August 1929 - 13 October 1987), better known by his stage name Kishore Kumar was an Indian playback singer, actor, music director, lyricist, writer, director, producer and screenwriter.",8496762
8,"A.R. Rahman",adocgyzst,fwjgeymzg,1,184,"Allahrakka Rahman born A. S. Dileep Kumar on 6 January 1967), known professionally as A. R. Rahman, is an Indian composer, singer and music producer.",9682491
9,"Atif Aslam",ivzbligfr,vxtyxihwh,1,136,"Muhammad Atif Aslam born 12 March 1985 is a Pakistani playback singer and actor.",3336911
10,"Sonu Nigam",rlsedkqjx,ohpymlhzn,2,186,"Sonu Nigam (born 30 July 1973) is an Indian playback singer, live performer, composer, host, and actor.",5635701
11,"Kumar Sanu",gyhnqswzc,ukcfyytzg,3,3,"Kedarnath Bhattacharjee (born 20 October 1957), better known as Kumar Sanu, is an Indian playback singer who mainly sings for Hindi and Bengali films.",2726314
12,Pritam,yhajwuvcl,xsjilzcfl,2,37,"Pritam Chakraborty (born 14 June 1971), also known mononymously as Pritam, is an Indian composer, instrumentalist, electronic guitar player, singer for Bollywood films.",2537943
13,Badshah,yojmgqjav,ogoyqmyrk,1,115,"Aditya Prateek Singh Sisodia, better known by his stage name Badshah, is an Indian rapper and singer known for his Hindi, Haryanvi, and Punjabi songs.",8027790
14,"Anu Malik",plgybtykd,oexaohmrq,1,187,"Anwar Sardar Malik (born 2 November 1960), best known as Anu Malik, is an Indian music director and singer.",9372065
15,"Diljit Dosanjh",pemjkwpyn,ugdcekzaz,1,156,"Diljit Dosanjh (born 6 January 1984) is an Indian singer, actor, television presenter and social media celebrity[1] who works in Punjabi and Hindi cinema.",8665687
16,"Shankar Mahadevan",pfyyqrgzi,skvombaak,1,114,"Shankar Mahadevan (born 3 March 1967) is an Indian singer and composer who is part of the Shankar Ehsaan Loy composing trio team for Indian films.",6083701
17,"Shankar Ehsaan Loy",uavvpokjt,xtkrqdwdc,2,156,"Shankar Ehsaan Loy (About this soundpronunciation (help info)) is an Indian musical trio consisting of Shankar Mahadevan, Ehsaan Noorani and Loy Mendonsa.",3094639
18,"Bappi Lahiri",gzzyqegya,jsniuufta,1,57,"Alokesh Lahiri is an Indian singer, composer, dancer, disco musician, actor and record producer. He popularized the use of synthesized disco music in Indian cinema and sang some of his own compositions.",8507594
19,Shaan,huedtpfgy,yqtfupejd,2,83,"Shantanu Mukherjee (born 30 September 1972), known as Shaan, is an Indian playback singer active in Hindi, Bengali, Marathi, Urdu, Telugu and Kannada films and a television host.",3657384
20,S.D.Burman,duaoajuzo,fhwjemkoj,2,157,"Sachin Dev Burman (1 October 1906 to 31 October 1975) was an Indian music director and singer. A member of the Tripura royal family, he started his career with Bengali films in 1937. ",4248571
21,"Gajendra Verma",ymniualtz,zjhllhkpk,1,94,"Gajendra Verma is an Indian singer, composer, lyricist and sound recordist . He came under the spotlight when he claimed that his song, titled Emptiness, also known as Tune Mere Jaana.",4211375
22,"Benny Dayal",tzeqmgcdl,lmdzkbuxv,1,7,"Benny Dayal (born 13 May 1984) is an Indian playback singer. He is a prominent singer in Hindi, Tamil, Telugu, Malayalam, Kannada, Bengali, Gujarati and Marathi languages films.",4182814
23,"Richa Sharma",edfxxdsjx,livpcchzr,1,168,"Richa Sharma (born 29 August 1974) is an Indian film playback singer as well a devotional singer.[1][2]",9963654
24,"Falguni Pathak",lnpkyothz,eenhgcjpb,5,106,"Falguni Pathak (born 12 March 1964) is an Indian singer, performing artist, and composer based in Mumbai. Her music is based on traditional musical forms from the Indian state of Gujarat. ",1974365
25,"Meet Bros",lkbkdkjlo,oyplhwqpc,1,100,"Meet Bros is a music director duo from Gwalior, Madhya Pradesh, India.",5787652
26,"Mika Singh",zasgdtncr,ibpgjissq,1,123,"Mika Singh is an Indian playback singer and live performer. Amongst a wide catalogue of songs, the prominent ones are Bas Ek King (Singh Is Kinng), Mauja Hi Mauja (Jab We Met), Ibn e Batuta (Ishqiya), and Dhanno (Housefull). ",5289229
27,"Sanjay Oza",vvmedtqtp,qlukhiuhx,3,124,"SANJAY OZA- A soulful singer, with a voice full of strength and expression.",2119029
28,"Parth Chaudhary",oakozingf,mmkhghvdw,2,113,"Parth Chaudhary is one among the Gujrati song artists of India.",4014060
29,"Geeta Rabari",tckqjkcdp,vxmnajlmy,2,40,"Geeta Rabari was born on 31 December 1996 in Kutch, Gujarat.",4453874
30,"Vijay Suvada",vbewjalje,kjegthhwk,1,62,"Vijay Suvada is one among the Gujrati song artists of India.",8025033
31,"Sachin Jigar",egpxiyvto,hrbxkhduf,2,70,"Sachin Jigar is a music composer duo from Mumbai, India, consisting of Sachin Sanghvi and Jigar Saraiya. They compose for Bollywood and Gujarati movies.",6212840
32,"Jayker Bhojak",lhpctfpxe,tardqfyur,3,77,"Jaishankar Bhudhardas Bhojak, (30 January 1889 - 22 January 1975) better known by his theatre name Jaishankar Sundari , was an Indian actor and director of Gujarati theatre.",5309914
33,"Shyamal Saumil",shgwvamxz,aemjvyboa,2,23,"Shyamal Saumil is an Indian classical music duo formed in 1980, in Ahmedabad, Gujarat, India, composed of the Gujarati singers, Dr. Shyamal Munshi and Saumil Munshi.",9906256
34,"Aarti Munshi",snqporhdb,tilcorama,3,140,"Aarti Munshi is a popular gujrati singer.",4418037
35,"Vatsala Patil",ycbkdwdfp,urjbqzbvw,2,113,"Vatsala Patil was born in a simple middle class family on August 22, 1959,(Border line between LEO and VIRGO sun signs) in Vadodara, Gujarat, India",7196626
36,"Bhoomi Trivedi",wpfhelgjf,yhazjlpms,1,52,"Bhoomi Trivedi is an Indian singer, known for her Bollywood songs Ram Chahe Leela from Goliyon Ki Raasleela: Ram Leela (2013)",3746023
37,"Atul Purohit",cvtjxshvu,zkwnjmnqw,1,38,"ATUL PUROHIT is the KING of timeless DANDIYA - GARBA hits, and a Limca Records holder",2360622
38,"Paritosh Goswami",fmtioksmy,bhplfqvbk,1,49,"Paritosh Goswami is a director and actor, known for Kabhi Yuh Bhi Toh Ho (2014)",7660433
39,"Sachin Limaye",fxidymyrm,ascuiaevr,1,31,"Sachin Limaye is renowned singer from Gujarat, India",5566484
40,"Achal Mehta",yabkahupf,dhcvcatwe,1,118,"Achal Mehta is a veteran Garba artist who performs mostly in Baroda, Gujarat. He has produced a number of Garba albums",7542200
41,"Daler Mehndi",nsnvbpbog,hgohwbazb,1,9,"Daler Singh (born 18 August 1967), better known as Daler Mehndi, is an Indian singer, songwriter, author and record producer.",5821029
42,"Sukhwinder Singh",qtditywfa,esakoykcj,3,152,"Sukhwinder Singh (born 18 July 1971) is an internationally acclaimed Indian Bollywood playback singer. Singh is famous internationally for singing Jai Ho from the film Slumdog Millionaire",9701208
43,"Malkit Singh",tjerpcifi,sevpipomp,3,50,"Malkit Singh,(Malkit Singh Boparai, born in 1963) is England based Punjabi bhangra singer. Born in Hussainpur and raised in Nakodar, he moved to Birmingham in 1984",7439611
44,"Gurdas Maan",iwpzpihin,suotdteml,3,181,"Gurdas Maan (born 4 January 1957) is an Indian singer, songwriter, choreographer and actor mainly associated with Punjabi language music and films. He gained national attention in 1980 with the song Dil Da Mamla Hai",2699784
45,"Guru Randhawa",jgubzgibh,yrzciecar,3,199,"Gursharanjot Singh Randhawa (born 30 August 1991) is an Indian singer, songwriter and music composer associated with Punjabi, Bhangra, Indi pop and Bollywood music",4221972
46,"Jasdeep Singh Gill",kmcjxjvwe,vulhxdbvw,2,60,"Jasdeep Singh Gill is an Indian singer and actor mainly associated with Punjabi music and films",2937325
47,Kesha,oaqbayvev,wkpcavotr,3,8,"Kesha Rose Sebert known mononymously as Kesha (formerly stylized Kesha), is an American singer, songwriter, rapper, and actress. In 2005, at age 18, Kesha was signed to Kemosabe Records",1108098
48,"Billie Eilish",yyhadvboe,cgtucqyci,5,94,"Billie Eilish Pirate Baird O Connell is an American singer and songwriter.",1176879
49,Halsey,nupnmapml,pvvyabfzt,4,70,"Ashley Nicolette Frangipane known professionally as Halsey is an American singer and songwriter.She was signed by Astralwerks in 2014 and released her debut EP, Room 93, later that year",3692807
50,"Tove Lo",zlusobfgm,ezneielyw,2,144,"Ebba Tove Elsa Nilsson known professionally as Tove Lo is a Swedish singer and songwriter. Called Sweden darkest pop export by Rolling Stone, she is known for her raw, grunge influenced take on pop music",4796427
51,Krewella,ndkbrkiun,rdnadtgqa,3,134,"Krewella is an American electronic dance music band from Northbrook, Illinois, United States, that formed in 2007.Their musical style has been mainly described as EDM dance rock and dance pop",1627373
52,"Tame Impala",dxoerhkxd,fnjqvzhva,2,83,"Tame Impala is an Australian psychedelic rock project led by multi instrumentalist Kevin Parker,[4] who writes, records, performs, and produces the music",793641
53,"The Weekend",djeaocglo,ikyehwhtt,4,79,"Abel Makkonen Tesfaye (born February 16, 1990), better known by his stage name The Weeknd, is a Canadian singer, songwriter, actor and record producer",6688641
54,"Selena Gomez",mzgntiwhz,qtsocjtcx,1,117,"Selena Marie Gomez (born July 22, 1992) is an American singer, songwriter, actress, and television produce",526783
55,Adele,wdugabovn,gdrcmdxcj,3,92,"Adele Laurie Blue Adkins MBE is an English singer songwriter. After graduating from the BRIT School in 2006, Adele signed a recording contract with XL Recordings",3006476
56,Akon,yxbcobxey,nkudttjyv,3,67,"Aliaune Damala Bouga Time Puru Nacka Lu Lu Lu Badara Akon Thiam is a Senegalese American singer, songwriter, record producer, entrepreneur, philanthropist and actor",5068318
57,"Alan Walker",svzbmxinn,atjgieyep,1,47,"Alan Olav Walker Bea is transexual (born 24 August 1997) is a British born Norwegian DJ and record producer",2907246
58,"Calvin Harris",ynpdeloim,dqcltaiqv,2,124,"Adam Richard Wiles (born 17 January 1984), known professionally as Calvin Harris, is a Scottish DJ, record producer, singer, and songwriter",370103
59,"Ariana Grande",adfumhqdq,ajdmuasfe,3,116,"Ariana Grande Butera (born June 26, 1993) is an American singer, songwriter, and actress. Born in Boca Raton",7020460
60,Avicii,oaxbmljyk,nboypekla,2,51,"Tim Bergling (8 September 1989 to 20 April 2018), known professionally as Avic, was a Swedish DJ, electronic musician, and songwriter who specialized in audio programming, remixing and record producing",6928410
61,"Rita Ora",eqddteskq,jzgvojjad,1,5,"Rita Sahatciu Ora (born Rita Sahatciu; 26 November 1990) is an English singer, songwriter and actress",5363879
62,Drake,ftcufkxgk,hbulbthuc,3,180,"Aubrey Drake Graham[11] (born October 24, 1986) is a Canadian rapper, singer, songwriter, producer, actor, and businessman",5919417
63,Khalid,icbltyomm,vftxirsnq,2,92,"Khalid Donnel Robinson (born February 11, 1998) is an American singer and songwriter. He is signed to Right Hand Music Group and RCA Records",6946173
64,"Bon Iver",ppsmhqpmp,vbnlmyfif,1,123,"Bon Iver is an American indie folk band founded in 2006 by singer songwriter Justin Vernon",7279021
65,"Bon Jovi",hsgoyhhtx,cmvjhafdy,2,162,"Richie Sambora Bon Jovi is an American rock band formed in 1983 in Sayreville, New Jersey",5826820
66,"Bryan Adams",oqqncxkhv,sajscnumq,3,89,"Bryan Guy Adams OC OBC (born 5 November 1959) is a Canadian singer, songwriter, record producer, guitarist, photographer, philanthropist, and activist.",5356892
67,"Enrique Iglesias",izjwuaytj,gdtmzqmzl,2,101,"Bryan Guy Adams OC OBC (born 5 November 1959) is a Canadian singer, songwriter, record producer, guitarist, photographer, philanthropist, and activist",8415940
68,"Katy Perry",szsljkhqo,pjgtzqkya,2,79,"Enrique Miguel Iglesias Preysler (born 8 May 1975) is a Spanish Filipino singer, songwriter, actor and record producer who is widely regarded as the King of Latin Pop",7513141
69,"Jennifer Lopez",yqvcmucjq,gcnbxbbav,1,136,"Katheryn Elizabeth Hudson (born October 25, 1984), known professionally as Katy Perry, is an American singer, songwriter, and television judge. After singing in church during her childhood, she pursued a career in gospel music as a teenager.",2581749
70,"Dua Lipa",rmxsslevo,pgfjvojdw,2,76,"Jennifer Lynn Lopez[2] (born July 24, 1969), also known by her nickname J.Lo, is an American actress, singer, dancer, fashion designer, producer and businesswoman.",6922413
71,Rihanna,jckkguyag,rkdqjraum,2,38,"Dua Lipa is an English singer, songwriter and model. After working as a model, she signed with Warner Music Group in 2015 and released her eponymous debut album in 2017",6308415
72,"Michael Jackson",zxosgvmdn,zwvfslske,1,196,"Robyn Rihanna Fenty is a Barbadian singer, songwriter, and businesswoman, who has been recognized for embracing various musical styles and reinventing her image throughout her career.",6923712
73,"Taylor Swift",ladyhzquh,hdnagsprk,2,1,"Michael Joseph Jackson was an American singer, songwriter, and dancer.",6960897
74,"Lady Gaga",qqfzlhyej,wiqzpfxjb,2,161,"Taylor Alison Swift is an American singer songwriter. She is known for narrative songs about her personal life, which have received widespread media coverage.",709812
75,"Camila Cabello",lxsehcqmt,fchkgyekd,2,19,"Stefani Joanne Angelina Germanotta, known professionally as Lady Gaga, is an American singer, songwriter, and actress.",5289869
76,"The Chainsmokers",jemyvkdbc,lncqonmgl,2,140,"Karla Camila Cabello Estrabao is a Cuban American singer, songwriter, and actress. ",9726054
77,"Daft Punk",hmvbqojiv,dbqphhvsw,1,163,"The Chainsmokers are an American electronic DJ and production duo consisting of Alexander Alex Pall and Andrew Drew Taggart. They started out by releasing remixes of songs by indie artists.",4708558
78,"DJ Snake",mpfmgsfar,kduvhdhxy,0,195,"Daft Punk is a French electronic music duo formed in Paris in 1993 by Guy Manuel de Homem Christo and Thomas Bangalter.",2991797
79,Foreigner,aytuipfma,mcztcgqfm,0,12,"William Sami Etienne Grigahcine, known professionally as DJ Snake, is a French DJ, record producer, and music programmer from Paris.",8406470
80,"Cardi B",ihwesdlxg,tdcfcauqo,0,81,"Foreigner is a British-American rock band, originally formed in New York City & London in 1976 by veteran English musician and ex-Spooky Tooth member Mick Jones, and fellow Briton and ex-King Crimson member Ian McDonald along with American vocalist Lou Gramm.",308199
81,"Hot Chelle Rae",hzeubflby,yiyqfhuyy,0,136,"Belcalis Marlenis Almanzar, known professionally as Cardi B, is an American rapper, songwriter, television personality and actress. Born in Manhattan and raised in The Bronx, New York City.",1901581
82,"Imagine Dragons",fubupsjzt,vcwmgvqvf,0,148,"Hot Chelle Rae is an American rock band formed in Nashville, Tennessee, in 2005.",5695806
83,BTS,muiijcudq,vnswyxlkq,6,188,"Imagine Dragons is an American pop rock band from Las Vegas, Nevada, consisting of lead singer Dan Reynolds, lead guitarist Wayne Sermon, bassist Ben McKee, and drummer Daniel Platzman.",334641
84,PSY,dpykaadmc,sfzekbnwl,6,7,"BTS, also known as the Bangtan Boys, is a seven member South Korean boy band that began its formation in Seoul in 2010. The septet co writes and produces much of their output.",7105581
85,"Red Velvet",jnskhjpoe,yfdqvhhmv,6,172,"Park Jae sang, known professionally as Psy, stylized in all caps, is a South Korean singer, rapper, songwriter, and record producer. Psy is known domestically for his humorous videos and stage performances.",7642498
86,TWICE,gzxaqkasa,yaxkerpje,7,8,"Red Velvet is a South Korean girl group formed by SM Entertainment. The group debuted on August 1, 2014, with the digital single Happiness and four group members: Irene, Seulgi, Wendy, and Joy.",4501588
87,Queen,taeimlwpd,vldfqwnpa,3,31,"Twice is a South Korean girl group formed by JYP Entertainment through the 2015 reality show Sixteen. The group debuted on October 20, 2015, with the extended play The Story Begins.",558085
88,"pink floyd",payntxglh,srxaadfxv,4,124,"Queen are a British rock band formed in London in 1970. Their classic line up was Freddie Mercury (lead vocals, piano), Brian May (guitar, vocals), John Deacon (bass guitar), and Roger Taylor (drums, vocals).",5127124
89,"Led Zeppelin",bljqgfemi,eoluflmxq,3,103,"Pink Floyd were an English rock band formed in London in 1965. Gaining a following as a psychedelic rock group",6544255
90,"Guns n Roses",phifkflfx,luifdhftv,4,46,"Led Zeppelin were an English rock band formed in London in 1968. ",3927886
91,Aerosmith,lrtlcduzf,lnprkcgym,1,156,"Guns N Roses, often abbreviated as GNR, is an American hard rock band from Los Angeles, California, formed in 1985.",9460457
92,Coldplay,pwyhvadfl,jbxorqgrg,2,112,"Aerosmith is an American rock band formed in Boston, Massachusetts in 1970.",2628602
93,AC/DC,kjezmlsth,cykjklwdg,1,141,"Coldplay are a British rock band formed in London in 1996.",863907
94,Nirvana,fcbobdagj,nrdtnndzt,3,98,"AC/DC are an Australian rock band formed in Sydney in 1973 by Scottish born brothers Malcolm and Angus Young.",9826681
95,"The Smiths",joageluzt,rsgwrufwv,2,119,"Nirvana was an American rock band formed in Aberdeen, Washington in 1987.",588323
96,"John Legend",iozjlxdgd,fwgwopjyo,2,8,"The Smiths were an English rock band formed in Manchester in 1982.",3687842
97,"The Doors",wljwaezsu,rqizpusdn,1,142,"John Roger Stephens, known professionally as John Legend, is an American singer, songwriter, producer, actor, and philanthropist.",4115308
98,OneRepublic,mmwxijeay,xhwtaexcc,1,94," The Doors were an American rock band formed in Los Angeles in 1965, with vocalist Jim Morrison.",8127817
99,"Fall Out Boy",vffbrmgls,lwbqqdwgx,1,63,"OneRepublic is an American pop rock band formed in Colorado Springs, Colorado, in 2002. ",847693
100,"Justin Bieber",vdnooxuot,ipdfdbcdg,3,51,"Fall Out Boy is an American rock band formed in Wilmette, Illinois, a suburb of Chicago, in 2001.",3728117
